{
    "$schema": "../../schema/source-manifest.schema.json",
    "schemaVersion": 1,
    "expressionVersion": 1,
    "name": "Full coverage test source",
    "description": "A generic source that uses every part of the data schema. Test fixture; not a real game.",
    "disclaimer": "Test data only.",
    "provides": [
        {
            "game": "game.json",
            "factions": ["factions/field-army.json"],
            "subFactions": [
                "sub-factions/veterans.json",
                "sub-factions/assault-doctrine.json",
                "sub-factions/siege-doctrine.json",
                "sub-factions/highland-heritage.json",
                "sub-factions/coastal-heritage.json"
            ]
        }
    ],
    "examples": ["lists/sample-list.json"]
}
